1000020304247,古座川町,,,1000020304247,,,,,,2025-12-04T02:09:15.905Z,,,,,,和歌山県東牟婁郡古座川町高池673-2,,,,,0735-72-0180,,,,http://www.town.kozagawa.lg.jp/,,-,,,,,,,,,,,,,,,,,,,,,,,,,,,,,,大分類; 公務（他に分類されるものを除く）; 中分類; 地方公務; 小分類; 市町村機関; 細分類; 市町村機関,公務（他に分類されるものを除く）,地方公務,市町村機関,市町村機関,,,,,,,,古座川町; 企業詳細; 古座川町; 法人番号：1000020304247; 基本情報; 人物; 条件に一致する部署はありません。; 企業メモ; 追加,,,,,,,,,,,,非上場,,,-,,,,,,,,,,,,,,,,,,,,,,,,,,,,,,,,,,,,,1000020304247,,,,,,,,,,,,,,,,,,,,,,古座川町  企業詳細  古座川町  法人番号：1000020304247  基本情報 部署 人物 代表者名 - 住所 和歌山県東牟婁郡古座川町高池673-2 売上 - 従業員数 - 資本金 - 設立 - 上場区分 非上場 決算月 - 業種  大分類 公務（他に分類されるものを除く）  中分類 地方公務  小分類 市町村機関  細分類 市町村機関  電話番号 0735-72-0180 URL http://www.town.kozagawa.lg.jp/ 来訪履歴  集計期間: 2025-10-21 〜 2025-11-20  最終来訪日時 - アクセス数 0 UU数 0 企業メモ 追加,,,,,,,,,,,
1000020304271,北山村,,,1000020304271,,,,,,2025-12-04T02:09:15.854Z,,,,,,和歌山県東牟婁郡北山村大字大沼42,,,,,0735-49-2331,,,,http://kankou.vill.kitayama.wakayama.jp/,,-,,,,,,,,,,,,,,,,,,,,,,,,,,,,,,大分類; 公務（他に分類されるものを除く）; 中分類; 地方公務; 小分類; 市町村機関; 細分類; 市町村機関,公務（他に分類されるものを除く）,地方公務,市町村機関,市町村機関,,,,,,,,北山村; 企業詳細; 北山村; 法人番号：1000020304271; 基本情報; 人物; 条件に一致する部署はありません。; 企業メモ; 追加,,,,,,,,,,,,非上場,,,-,,,,,,,,,,,,,,,,,,,,,,,,,,,,,,,,,,,,,1000020304271,,,,,,,,,,,,,,,,,,,,,,北山村  企業詳細  北山村  法人番号：1000020304271  基本情報 部署 人物 代表者名 - 住所 和歌山県東牟婁郡北山村大字大沼42 売上 - 従業員数 - 資本金 - 設立 - 上場区分 非上場 決算月 - 業種  大分類 公務（他に分類されるものを除く）  中分類 地方公務  小分類 市町村機関  細分類 市町村機関  電話番号 0735-49-2331 URL http://kankou.vill.kitayama.wakayama.jp/ 来訪履歴  集計期間: 2025-10-21 〜 2025-11-20  最終来訪日時 - アクセス数 0 UU数 0 企業メモ 追加,,,,,,,,,,,
1000020308099,公立那賀病院経営事務組合,,,1000020308099,,,,,,2025-12-07T17:23:14.326Z,,,,,,和歌山県紀の川市打田1282,,,,,-,,,,,,-,,,,,,,,,,,,,,,,,,,,,,,,,,,,,,,,,,,,,,,,,,公立那賀病院経営事務組合; 企業詳細; 公立那賀病院経営事務組合; 法人番号：1000020308099; 基本情報; 人物; 条件に一致する部署はありません。; 企業メモ; 追加,,,,,,,,,,,,非上場,,,-,,,,,,,,,,,,,,,,,,,,,,,,,,公立那賀病院経営事務組合  企業詳細  公立那賀病院経営事務組合  法人番号：1000020308099  基本情報 部署 人物 代表者名 - 住所 和歌山県紀の川市打田1282 売上 - 従業員数 - 資本金 - 設立 - 上場区分 - 決算月 - 業種 電話番号 - URL - 来訪履歴  集計期間: 2025-10-21 〜 2025-11-20  最終来訪日時 - アクセス数 0 UU数 0 企業メモ 追加,,,,,,,,,,,1000020308099,,,,,,,,,,,,,,,,,,,,,,公立那賀病院経営事務組合  企業詳細  公立那賀病院経営事務組合  法人番号：1000020308099  基本情報 部署 人物 代表者名 - 住所 和歌山県紀の川市打田1282 売上 - 従業員数 - 資本金 - 設立 - 上場区分 - 決算月 - 業種 電話番号 - URL - 来訪履歴  集計期間: 2025-10-21 〜 2025-11-20  最終来訪日時 - アクセス数 0 UU数 0 企業メモ 追加,,,,,,,,,,,
1000020308561,那智勝浦町太地町環境衛生施設一部事務組合,,,1000020308561,,,,,,2025-12-07T17:23:14.326Z,,,,,,和歌山県東牟婁郡那智勝浦町大字市屋1054-9,,,,,-,,,,,,-,,,,,,,,,,,,,,,,,,,,,,,,,,,,,,,,,,,,,,,,,,那智勝浦町太地町環境衛生施設一部事務組合; 企業詳細; 那智勝浦町太地町環境衛生施設一部事務組合; 法人番号：1000020308561; 基本情報; 人物; 条件に一致する部署はありません。; 企業メモ; 追加,,,,,,,,,,,,非上場,,,-,,,,,,,,,,,,,,,,,,,,,,,,,,那智勝浦町太地町環境衛生施設一部事務組合  企業詳細  那智勝浦町太地町環境衛生施設一部事務組合  法人番号：1000020308561  基本情報 部署 人物 代表者名 - 住所 和歌山県東牟婁郡那智勝浦町大字市屋1054-9 売上 - 従業員数 - 資本金 - 設立 - 上場区分 - 決算月 - 業種 電話番号 - URL - 来訪履歴  集計期間: 2025-10-21 〜 2025-11-20  最終来訪日時 - アクセス数 0 UU数 0 企業メモ 追加,,,,,,,,,,,1000020308561,,,,,,,,,,,,,,,,,,,,,,那智勝浦町太地町環境衛生施設一部事務組合  企業詳細  那智勝浦町太地町環境衛生施設一部事務組合  法人番号：1000020308561  基本情報 部署 人物 代表者名 - 住所 和歌山県東牟婁郡那智勝浦町大字市屋1054-9 売上 - 従業員数 - 資本金 - 設立 - 上場区分 - 決算月 - 業種 電話番号 - URL - 来訪履歴  集計期間: 2025-10-21 〜 2025-11-20  最終来訪日時 - アクセス数 0 UU数 0 企業メモ 追加,,,,,,,,,,,
1000020313025,岩美町,,,1000020313025,,,,,,2025-12-07T17:23:14.326Z,,,,,,鳥取県岩美郡岩美町大字浦富675-1,,,,,0857-73-1411,,,,https://www.iwami.gr.jp/,,-,,,,,,,,,,,,,,,,,,,,,,,,,,,,,,,,,,,,,,,,,,岩美町; 企業詳細; 岩美町; 法人番号：1000020313025; 基本情報; 人物; 条件に一致する部署はありません。; 企業メモ; 追加,,,,,,,,,,,,非上場,,,-,,,,,,,,,,,,,,,,,,,,,,,,,,,,,,,,,,,,,1000020313025,,,,,,,,,,,,,,,,,,,,,,岩美町  企業詳細  岩美町  法人番号：1000020313025  基本情報 部署 人物 代表者名 - 住所 鳥取県岩美郡岩美町大字浦富675-1 売上 - 従業員数 - 資本金 - 設立 - 上場区分 - 決算月 - 業種 電話番号 0857-73-1411 URL https://www.iwami.gr.jp/ 来訪履歴  集計期間: 2025-10-21 〜 2025-11-20  最終来訪日時 - アクセス数 0 UU数 0 企業メモ 追加,,,,,,,,,,,
1000020313289,智頭町,,,1000020313289,,,,,,2025-12-04T02:09:26.864Z,,,,,,鳥取県八頭郡智頭町大字智頭2072-1,,,,,0858-75-4111,,,,http://www.town.chizu.tottori.jp/,,-,,,,,,,,,,,,,,,,,,,,,,,,,,,,,,大分類; 公務（他に分類されるものを除く）; 中分類; 地方公務; 小分類; 市町村機関; 細分類; 市町村機関,公務（他に分類されるものを除く）,地方公務,市町村機関,市町村機関,,,,,,,,智頭町; 企業詳細; 智頭町; 法人番号：1000020313289; 基本情報; 人物; 条件に一致する部署はありません。; 企業メモ; 追加,,,,,,,,,,,,非上場,,,-,,,,,,,,,,,,,,,,,,,,,,,,,,,,,,,,,,,,,1000020313289,,,,,,,,,,,,,,,,,,,,,,智頭町  企業詳細  智頭町  法人番号：1000020313289  基本情報 部署 人物 代表者名 - 住所 鳥取県八頭郡智頭町大字智頭2072-1 売上 - 従業員数 - 資本金 - 設立 - 上場区分 非上場 決算月 - 業種  大分類 公務（他に分類されるものを除く）  中分類 地方公務  小分類 市町村機関  細分類 市町村機関  電話番号 0858-75-4111 URL http://www.town.chizu.tottori.jp/ 来訪履歴  集計期間: 2025-10-21 〜 2025-11-20  最終来訪日時 - アクセス数 0 UU数 0 企業メモ 追加,,,,,,,,,,,
1000020313297,八頭町,,,1000020313297,,,,,,2025-12-04T02:09:26.809Z,,,,,,鳥取県八頭郡八頭町郡家493,,,,,0858-76-0201,,,,http://www.town.yazu.tottori.jp/dd.aspx,,-,,,,,,,,,,,,,,,,,,,,,,,,,,,,,,大分類; 公務（他に分類されるものを除く）; 中分類; 地方公務; 小分類; 市町村機関; 細分類; 市町村機関,公務（他に分類されるものを除く）,地方公務,市町村機関,市町村機関,,,,,,,,八頭町; 企業詳細; 八頭町; 法人番号：1000020313297; 基本情報; 人物; 条件に一致する部署はありません。; 企業メモ; 追加,,,,,,,,,,,,非上場,,,-,,,,,,,,,,,,,,,,,,,,,,,,,,,,,,,,,,,,,1000020313297,,,,,,,,,,,,,,,,,,,,,,八頭町  企業詳細  八頭町  法人番号：1000020313297  基本情報 部署 人物 代表者名 - 住所 鳥取県八頭郡八頭町郡家493 売上 - 従業員数 - 資本金 - 設立 - 上場区分 非上場 決算月 - 業種  大分類 公務（他に分類されるものを除く）  中分類 地方公務  小分類 市町村機関  細分類 市町村機関  電話番号 0858-76-0201 URL http://www.town.yazu.tottori.jp/dd.aspx 来訪履歴  集計期間: 2025-10-21 〜 2025-11-20  最終来訪日時 - アクセス数 0 UU数 0 企業メモ 追加,,,,,,,,,,,
1000020313891,南部町,,,1000020313891,,,,,,2025-12-04T02:09:26.755Z,,,,,,鳥取県西伯郡南部町法勝寺377-1,,,,,0859-66-3112,,,,http://www.town.nanbu.tottori.jp/,,地方公務,,,,,,,,,,,,,,,,,,,,,,,,,,,,,,,公務（他に分類されるものを除く）,地方公務,市町村機関,市町村機関,,,,,,,,,,,,,,,,,,,,非上場,,,-,,,,,,,,,,,,,,,,,,,,,,,,,,,,,,,,,,,,,,,,,,,,,,,,,,,,,,,,,,,,,,,,,,,,,,
1000020318370,南部箕蚊屋広域連合,,,1000020318370,,,,,,2025-12-07T17:23:14.326Z,,,,,,鳥取県西伯郡南部町法勝寺377-1(南部町役場内),,,,,-,,,,,,-,,,,,,,,,,,,,,,,,,,,,,,,,,,,,,,,,,,,,,,,,,南部箕蚊屋広域連合; 企業詳細; 南部箕蚊屋広域連合; 法人番号：1000020318370; 基本情報; 人物; 条件に一致する部署はありません。; 企業メモ; 追加,,,,,,,,,,,,非上場,,,-,,,,,,,,,,,,,,,,,,,,,,,,,,南部箕蚊屋広域連合  企業詳細  南部箕蚊屋広域連合  法人番号：1000020318370  基本情報 部署 人物 代表者名 - 住所 鳥取県西伯郡南部町法勝寺377-1(南部町役場内) 売上 - 従業員数 - 資本金 - 設立 - 上場区分 - 決算月 - 業種 電話番号 - URL - 来訪履歴  集計期間: 2025-10-21 〜 2025-11-20  最終来訪日時 - アクセス数 0 UU数 0 企業メモ 追加,,,,,,,,,,,1000020318370,,,,,,,,,,,,,,,,,,,,,,南部箕蚊屋広域連合  企業詳細  南部箕蚊屋広域連合  法人番号：1000020318370  基本情報 部署 人物 代表者名 - 住所 鳥取県西伯郡南部町法勝寺377-1(南部町役場内) 売上 - 従業員数 - 資本金 - 設立 - 上場区分 - 決算月 - 業種 電話番号 - URL - 来訪履歴  集計期間: 2025-10-21 〜 2025-11-20  最終来訪日時 - アクセス数 0 UU数 0 企業メモ 追加,,,,,,,,,,,
1000020320005,島根県,,,1000020320005,,,,,,2025-12-04T02:09:26.647Z,,,,,,島根県松江市殿町1,,,,,0852-22-5111,,,,http://www.pref.shimane.lg.jp/,,-,,,,,,,,,,,,,,,,,,,,,,,,,,,,,,大分類; 公務（他に分類されるものを除く）; 中分類; 地方公務; 小分類; 都道府県機関; 細分類; 都道府県機関,公務（他に分類されるものを除く）,地方公務,都道府県機関,都道府県機関,,,,,,,,島根県; 企業詳細; 島根県; 法人番号：1000020320005; 基本情報; 人物; 条件に一致する部署はありません。; 企業メモ; 追加,,,,,,,,,,,,非上場,,,-,,,,,,,,,,,,,,,,,,,,,,,,,,,,,,,,,,,,,1000020320005,,,,,,,,,,,,,,,,,,,,,,島根県  企業詳細  島根県  法人番号：1000020320005  基本情報 部署 人物 代表者名 - 住所 島根県松江市殿町1 売上 - 従業員数 - 資本金 - 設立 - 上場区分 非上場 決算月 - 業種  大分類 公務（他に分類されるものを除く）  中分類 地方公務  小分類 都道府県機関  細分類 都道府県機関  電話番号 0852-22-5111 URL http://www.pref.shimane.lg.jp/ 来訪履歴  集計期間: 2025-10-21 〜 2025-11-20  最終来訪日時 - アクセス数 0 UU数 0 企業メモ 追加,,,,,,,,,,,
1000020322059,大田市,,,1000020322059,,,,,,2025-12-04T02:09:26.591Z,,,,,,島根県大田市大田町大田ロ1111,,,,,0854-82-1600,,,,http://www.iwamigin.jp/ohda/,,-,,,,,,,,,,,,,,,,,,,,,,,,,,,,,,大分類; 公務（他に分類されるものを除く）; 中分類; 地方公務; 小分類; 市町村機関; 細分類; 市町村機関,公務（他に分類されるものを除く）,地方公務,市町村機関,市町村機関,,,,,,,,大田市; 企業詳細; 大田市; 法人番号：1000020322059; 基本情報; 人物; 条件に一致する部署はありません。; 企業メモ; 追加,,,,,,,,,,,,非上場,,,-,,,,,,,,,,,,,,,,,,,,,,,,,,,,,,,,,,,,,1000020322059,,,,,,,,,,,,,,,,,,,,,,大田市  企業詳細  大田市  法人番号：1000020322059  基本情報 部署 人物 代表者名 - 住所 島根県大田市大田町大田ロ1111 売上 - 従業員数 - 資本金 - 設立 - 上場区分 非上場 決算月 - 業種  大分類 公務（他に分類されるものを除く）  中分類 地方公務  小分類 市町村機関  細分類 市町村機関  電話番号 0854-82-1600 URL http://www.iwamigin.jp/ohda/ 来訪履歴  集計期間: 2025-10-21 〜 2025-11-20  最終来訪日時 - アクセス数 0 UU数 0 企業メモ 追加,,,,,,,,,,,
1000020322067,安来市,,,1000020322067,,,,,,2025-12-04T02:09:26.534Z,,,,,,島根県安来市安来町878-2,,,,,0854-23-3000,,,,http://www.city.yasugi.shimane.jp/,,-,,,,,,,,,,,,,,,,,,,,,,,,,,,,,,大分類; 公務（他に分類されるものを除く）; 中分類; 地方公務; 小分類; 市町村機関; 細分類; 市町村機関,公務（他に分類されるものを除く）,地方公務,市町村機関,市町村機関,,,,,,,,安来市; 企業詳細; 安来市; 法人番号：1000020322067; 基本情報; 人物; 条件に一致する部署はありません。; 企業メモ; 追加,,,,,,,,,,,,非上場,,,-,,,,,,,,,,,,,,,,,,,,,,,,,,,,,,,,,,,,,1000020322067,,,,,,,,,,,,,,,,,,,,,,安来市  企業詳細  安来市  法人番号：1000020322067  基本情報 部署 人物 代表者名 - 住所 島根県安来市安来町878-2 売上 - 従業員数 - 資本金 - 設立 - 上場区分 非上場 決算月 - 業種  大分類 公務（他に分類されるものを除く）  中分類 地方公務  小分類 市町村機関  細分類 市町村機関  電話番号 0854-23-3000 URL http://www.city.yasugi.shimane.jp/ 来訪履歴  集計期間: 2025-10-21 〜 2025-11-20  最終来訪日時 - アクセス数 0 UU数 0 企業メモ 追加,,,,,,,,,,,
1000020322075,江津市,,,1000020322075,,,,,,,,,,,,島根県浜田市長沢町736,,,,,0855-52-2501,,,,https://www.city.gotsu.lg.jp/,,,,,,,,,,,,,,,,,,,,,,,,,,,,,,,,公務（他に分類されるものを除く）,公務（他に分類されるものを除く）,地方公務,市町村機関,市町村機関,,,,,,,,,,10000000000,,,,,,,,,,非上場,,,-,,,,,,,,,,,,,,,,101,,,,,,,,,,,,,,,,,,,,,,,,,,,,,,,,,,,,,,,,,,,,,,,,,,,,,,
1000020322091,雲南市,,,1000020322091,,,,,,2025-12-04T02:09:26.486Z,,,,,,島根県雲南市木次町里方521-1,,,,,0854-40-1000,,,,http://www.city.unnan.shimane.jp/,,-,,,,,,,,,,,,,,,,,,,,,,,,,,,,,,大分類; 公務（他に分類されるものを除く）; 中分類; 地方公務; 小分類; 市町村機関; 細分類; 市町村機関,公務（他に分類されるものを除く）,地方公務,市町村機関,市町村機関,,,,,,,,雲南市; 企業詳細; 雲南市; 法人番号：1000020322091; 基本情報; 人物; 条件に一致する部署はありません。; 企業メモ; 追加,,,,,,,,,,,,非上場,,,-,,,,,,,,,,,,,,,,,,,,,,,,,,,,,,,,,,,,,1000020322091,,,,,,,,,,,,,,,,,,,,,,雲南市  企業詳細  雲南市  法人番号：1000020322091  基本情報 部署 人物 代表者名 - 住所 島根県雲南市木次町里方521-1 売上 - 従業員数 - 資本金 - 設立 - 上場区分 非上場 決算月 - 業種  大分類 公務（他に分類されるものを除く）  中分類 地方公務  小分類 市町村機関  細分類 市町村機関  電話番号 0854-40-1000 URL http://www.city.unnan.shimane.jp/ 来訪履歴  集計期間: 2025-10-21 〜 2025-11-20  最終来訪日時 - アクセス数 0 UU数 0 企業メモ 追加,,,,,,,,,,,
1000020328766,雲南市・飯南町事務組合,,,1000020328766,,,,,,2025-12-04T02:09:26.432Z,,,,,,島根県雲南市掛合町掛合1261-3,,,,,0854-62-9550,,,,http://unnan-yume.net/,,-,,,,,,,,,,,,,,,,,,,,,,,,,,,,,,大分類; 情報通信業; 中分類; 放送業; 小分類; 有線放送業; 細分類; 有線テレビジョン放送業,情報通信業,放送業,有線放送業,有線テレビジョン放送業,,,,,,,,雲南市・飯南町事務組合; 企業詳細; 雲南市・飯南町事務組合; 法人番号：1000020328766; 基本情報; 人物; 条件に一致する部署はありません。; 企業メモ; 追加,,,,,,,,,,,,非上場,,,-,,,,,,,,,,,,,,,,,,,,,,,,,,,,,,,,,,,,,1000020328766,,,,,,,,,,,,,,,,,,,,,,雲南市・飯南町事務組合  企業詳細  雲南市・飯南町事務組合  法人番号：1000020328766  基本情報 部署 人物 代表者名 - 住所 島根県雲南市掛合町掛合1261-3 売上 - 従業員数 - 資本金 - 設立 - 上場区分 非上場 決算月 - 業種  大分類 情報通信業  中分類 放送業  小分類 有線放送業  細分類 有線テレビジョン放送業  電話番号 0854-62-9550 URL http://unnan-yume.net/ 来訪履歴  集計期間: 2025-10-21 〜 2025-11-20  最終来訪日時 - アクセス数 0 UU数 0 企業メモ 追加,,,,,,,,,,,
1000020336637,久米南町,,,1000020336637,,,,,,2025-12-04T02:09:26.359Z,,,,,,岡山県久米郡久米南町下弓削502-1,,,,,086-728-2111,,,,https://www.town.kumenan.lg.jp/,,-,,,,,,,,,,,,,,,,,,,,,,,,,,,,,,大分類; 公務（他に分類されるものを除く）; 中分類; 地方公務; 小分類; 市町村機関; 細分類; 市町村機関,公務（他に分類されるものを除く）,地方公務,市町村機関,市町村機関,,,,,,,,久米南町; 企業詳細; 久米南町; 法人番号：1000020336637; 基本情報; 人物; 条件に一致する部署はありません。; 企業メモ; 追加,,,,,,,,,,,,非上場,,,-,,,,,,,,,,,,,,,,,,,,,,,,,,,,,,,,,,,,,1000020336637,,,,,,,,,,,,,,,,,,,,,,久米南町  企業詳細  久米南町  法人番号：1000020336637  基本情報 部署 人物 代表者名 - 住所 岡山県久米郡久米南町下弓削502-1 売上 - 従業員数 - 資本金 - 設立 - 上場区分 非上場 決算月 - 業種  大分類 公務（他に分類されるものを除く）  中分類 地方公務  小分類 市町村機関  細分類 市町村機関  電話番号 086-728-2111 URL https://www.town.kumenan.lg.jp/ 来訪履歴  集計期間: 2025-10-21 〜 2025-11-20  最終来訪日時 - アクセス数 0 UU数 0 企業メモ 追加,,,,,,,,,,,
1000020336661,美咲町,,,1000020336661,,,,,,2025-12-04T02:09:26.308Z,,,,,,岡山県久米郡美咲町原田1735,,,,,0868-66-1111,,,,https://www.town.misaki.okayama.jp/,,-,,,,,,,,,,,,,,,,,,,,,,,,,,,,,,大分類; 公務（他に分類されるものを除く）; 中分類; 地方公務; 小分類; 市町村機関; 細分類; 市町村機関,公務（他に分類されるものを除く）,地方公務,市町村機関,市町村機関,,,,,,,,美咲町; 企業詳細; 美咲町; 法人番号：1000020336661; 基本情報; 人物; 条件に一致する部署はありません。; 企業メモ; 追加,,,,,,,,,,,,非上場,,,-,,,,,,,,,,,,,,,,,,,,,,,,,,,,,,,,,,,,,1000020336661,,,,,,,,,,,,,,,,,,,,,,美咲町  企業詳細  美咲町  法人番号：1000020336661  基本情報 部署 人物 代表者名 - 住所 岡山県久米郡美咲町原田1735 売上 - 従業員数 - 資本金 - 設立 - 上場区分 非上場 決算月 - 業種  大分類 公務（他に分類されるものを除く）  中分類 地方公務  小分類 市町村機関  細分類 市町村機関  電話番号 0868-66-1111 URL https://www.town.misaki.okayama.jp/ 来訪履歴  集計期間: 2025-10-21 〜 2025-11-20  最終来訪日時 - アクセス数 0 UU数 0 企業メモ 追加,,,,,,,,,,,
1000020338419,備南水道企業団,,,1000020338419,,,,,,2025-12-07T17:23:14.326Z,,,,,,岡山県倉敷市西中新田640,,,,,-,,,,,,-,,,,,,,,,,,,,,,,,,,,,,,,,,,,,,,,,,,,,,,,,,備南水道企業団; 企業詳細; 備南水道企業団; 法人番号：1000020338419; 基本情報; 人物; 条件に一致する部署はありません。; 企業メモ; 追加,,,,,,,,,,,,非上場,,,-,,,,,,,,,,,,,,,,,,,,,,,,,,備南水道企業団  企業詳細  備南水道企業団  法人番号：1000020338419  基本情報 部署 人物 代表者名 - 住所 岡山県倉敷市西中新田640 売上 - 従業員数 - 資本金 - 設立 - 上場区分 - 決算月 - 業種 電話番号 - URL - 来訪履歴  集計期間: 2025-10-21 〜 2025-11-20  最終来訪日時 - アクセス数 0 UU数 0 企業メモ 追加,,,,,,,,,,,1000020338419,,,,,,,,,,,,,,,,,,,,,,備南水道企業団  企業詳細  備南水道企業団  法人番号：1000020338419  基本情報 部署 人物 代表者名 - 住所 岡山県倉敷市西中新田640 売上 - 従業員数 - 資本金 - 設立 - 上場区分 - 決算月 - 業種 電話番号 - URL - 来訪履歴  集計期間: 2025-10-21 〜 2025-11-20  最終来訪日時 - アクセス数 0 UU数 0 企業メモ 追加,,,,,,,,,,,
1000020338427,岡山県南部水道企業団,,,1000020338427,,,,,,2025-12-07T17:23:14.326Z,,,,,,岡山県倉敷市西阿知町247-1,,,,,-,,,,,,-,,,,,,,,,,,,,,,,,,,,,,,,,,,,,,,,,,,,,,,,,,岡山県南部水道企業団; 企業詳細; 岡山県南部水道企業団; 法人番号：1000020338427; 基本情報; 人物; 条件に一致する部署はありません。; 企業メモ; 追加,,,,,,,,,,,,非上場,,,-,,,,,,,,,,,,,,,,,,,,,,,,,,,,,,,,,,,,,1000020338427,,,,,,,,,,,,,,,,,,,,,,岡山県南部水道企業団  企業詳細  岡山県南部水道企業団  法人番号：1000020338427  基本情報 部署 人物 代表者名 - 住所 岡山県倉敷市西阿知町247-1 売上 - 従業員数 - 資本金 - 設立 - 上場区分 - 決算月 - 業種 電話番号 - URL - 来訪履歴  集計期間: 2025-10-21 〜 2025-11-20  最終来訪日時 - アクセス数 0 UU数 0 企業メモ 追加,,,,,,,,,,,
1000020338451,岡山県西南水道企業団,,,1000020338451,,,,,,2025-12-07T17:23:14.326Z,,,,,,岡山県笠岡市十一番町4-1,,,,,-,,,,,,-,,,,,,,,,,,,,,,,,,,,,,,,,,,,,,,,,,,,,,,,,,岡山県西南水道企業団; 企業詳細; 岡山県西南水道企業団; 法人番号：1000020338451; 基本情報; 人物; 条件に一致する部署はありません。; 企業メモ; 追加,,,,,,,,,,,,非上場,,,-,,,,,,,,,,,,,,,,,,,,,,,,,,,,,,,,,,,,,1000020338451,,,,,,,,,,,,,,,,,,,,,,岡山県西南水道企業団  企業詳細  岡山県西南水道企業団  法人番号：1000020338451  基本情報 部署 人物 代表者名 - 住所 岡山県笠岡市十一番町4-1 売上 - 従業員数 - 資本金 - 設立 - 上場区分 - 決算月 - 業種 電話番号 - URL - 来訪履歴  集計期間: 2025-10-21 〜 2025-11-20  最終来訪日時 - アクセス数 0 UU数 0 企業メモ 追加,,,,,,,,,,,
1000020338559,岡山県西部環境整備施設組合,,,1000020338559,,,,,,2025-12-07T17:23:14.326Z,,,,,,岡山県浅口郡里庄町大字新庄3655,,,,,-,,,,,,-,,,,,,,,,,,,,,,,,,,,,,,,,,,,,,,,,,,,,,,,,,岡山県西部環境整備施設組合; 企業詳細; 岡山県西部環境整備施設組合; 法人番号：1000020338559; 基本情報; 人物; 条件に一致する部署はありません。; 企業メモ; 追加,,,,,,,,,,,,非上場,,,-,,,,,,,,,,,,,,,,,,,,,,,,,,,,,,,,,,,,,1000020338559,,,,,,,,,,,,,,,,,,,,,,岡山県西部環境整備施設組合  企業詳細  岡山県西部環境整備施設組合  法人番号：1000020338559  基本情報 部署 人物 代表者名 - 住所 岡山県浅口郡里庄町大字新庄3655 売上 - 従業員数 - 資本金 - 設立 - 上場区分 - 決算月 - 業種 電話番号 - URL - 来訪履歴  集計期間: 2025-10-21 〜 2025-11-20  最終来訪日時 - アクセス数 0 UU数 0 企業メモ 追加,,,,,,,,,,,
1000020338567,和気北部衛生施設組合,,,1000020338567,,,,,,2025-12-07T17:23:14.326Z,,,,,,岡山県和気郡和気町尺所555,,,,,-,,,,,,-,,,,,,,,,,,,,,,,,,,,,,,,,,,,,,,,,,,,,,,,,,和気北部衛生施設組合; 企業詳細; 和気北部衛生施設組合; 法人番号：1000020338567; 基本情報; 人物; 条件に一致する部署はありません。; 企業メモ; 追加,,,,,,,,,,,,非上場,,,-,,,,,,,,,,,,,,,,,,,,,,,,,,和気北部衛生施設組合  企業詳細  和気北部衛生施設組合  法人番号：1000020338567  基本情報 部署 人物 代表者名 - 住所 岡山県和気郡和気町尺所555 売上 - 従業員数 - 資本金 - 設立 - 上場区分 - 決算月 - 業種 電話番号 - URL - 来訪履歴  集計期間: 2025-10-21 〜 2025-11-20  最終来訪日時 - アクセス数 0 UU数 0 企業メモ 追加,,,,,,,,,,,1000020338567,,,,,,,,,,,,,,,,,,,,,,和気北部衛生施設組合  企業詳細  和気北部衛生施設組合  法人番号：1000020338567  基本情報 部署 人物 代表者名 - 住所 岡山県和気郡和気町尺所555 売上 - 従業員数 - 資本金 - 設立 - 上場区分 - 決算月 - 業種 電話番号 - URL - 来訪履歴  集計期間: 2025-10-21 〜 2025-11-20  最終来訪日時 - アクセス数 0 UU数 0 企業メモ 追加,,,,,,,,,,,
