1000030180001,芦原温泉上水道財産区,,,1000030180001,,,,,,2025-12-07T17:23:14.326Z,,,,,,福井県あわら市二面第34号25番地4,,1056021,,,-,,,Kingdomline@gdpr-rep.com,https://atrae.co.jp/external_transmission/,,-,,代表取締役,,,,,,,,,,,,,,,,,,,,,,,,,,,,,,,,,,,LINEヤフー株式会社の企業情報のページです。,,,,,芦原温泉上水道財産区; 企業詳細; 芦原温泉上水道財産区; 法人番号：1000030180001; 基本情報; 人物; 条件に一致する部署はありません。; 企業メモ; 追加,,,,,,,,,,,,非上場,,,-,,,,,,,,,,,,,,,,,,,,,,,,,,芦原温泉上水道財産区  企業詳細  芦原温泉上水道財産区  法人番号：1000030180001  基本情報 部署 人物 代表者名 - 住所 福井県あわら市二面第34号25番地4 売上 - 従業員数 - 資本金 - 設立 - 上場区分 - 決算月 - 業種 電話番号 - URL - 来訪履歴  集計期間: 2025-10-21 〜 2025-11-20  最終来訪日時 - アクセス数 0 UU数 0 企業メモ 追加,,,,,,,,,,,1000030180001,,,,,,,,,,,,,,,,,,,,,,芦原温泉上水道財産区  企業詳細  芦原温泉上水道財産区  法人番号：1000030180001  基本情報 部署 人物 代表者名 - 住所 福井県あわら市二面第34号25番地4 売上 - 従業員数 - 資本金 - 設立 - 上場区分 - 決算月 - 業種 電話番号 - URL - 来訪履歴  集計期間: 2025-10-21 〜 2025-11-20  最終来訪日時 - アクセス数 0 UU数 0 企業メモ 追加,LINEヤフー株式会社の企業情報のページです。,LINEヤフー株式会社の企業情報のページです。,,,,,,,,,
1000030190009,日蔭山恩賜県有財産保護財産区,,,1000030190009,,,,,,2025-12-07T17:23:14.326Z,,,,,,山梨県甲府市丸の内1丁目18-1,,1056021,,,-,,,Kingdomline@gdpr-rep.com,https://atrae.co.jp/external_transmission/,,-,,代表取締役,,,,,,,,,,,,,,,,,,,,,,,,,,,,,,,,,,,LINEヤフー株式会社の企業情報のページです。,,,,,日蔭山恩賜県有財産保護財産区; 企業詳細; 日蔭山恩賜県有財産保護財産区; 法人番号：1000030190009; 基本情報; 人物; 条件に一致する部署はありません。; 企業メモ; 追加,,,,,,,,,,,,非上場,,,-,,,,,,,,,,,,,,,,,,,,,,,,,,日蔭山恩賜県有財産保護財産区  企業詳細  日蔭山恩賜県有財産保護財産区  法人番号：1000030190009  基本情報 部署 人物 代表者名 - 住所 山梨県甲府市丸の内1丁目18-1 売上 - 従業員数 - 資本金 - 設立 - 上場区分 - 決算月 - 業種 電話番号 - URL - 来訪履歴  集計期間: 2025-10-21 〜 2025-11-20  最終来訪日時 - アクセス数 0 UU数 0 企業メモ 追加,,,,,,,,,,,1000030190009,,,,,,,,,,,,,,,,,,,,,,日蔭山恩賜県有財産保護財産区  企業詳細  日蔭山恩賜県有財産保護財産区  法人番号：1000030190009  基本情報 部署 人物 代表者名 - 住所 山梨県甲府市丸の内1丁目18-1 売上 - 従業員数 - 資本金 - 設立 - 上場区分 - 決算月 - 業種 電話番号 - URL - 来訪履歴  集計期間: 2025-10-21 〜 2025-11-20  最終来訪日時 - アクセス数 0 UU数 0 企業メモ 追加,LINEヤフー株式会社の企業情報のページです。,LINEヤフー株式会社の企業情報のページです。,,,,,,,,,
1000030190017,鹿留財産区,,,1000030190017,,,,,,2025-12-07T17:23:14.326Z,,,,,,山梨県都留市,,1056021,,,-,,,Kingdomline@gdpr-rep.com,https://atrae.co.jp/external_transmission/,,-,,代表取締役,,,,,,,,,,,,,,,,,,,,,,,,,,,,,,,,,,,LINEヤフー株式会社の企業情報のページです。,,,,,鹿留財産区; 企業詳細; 鹿留財産区; 法人番号：1000030190017; 基本情報; 人物; 条件に一致する部署はありません。; 企業メモ; 追加,,,,,,,,,,,,非上場,,,-,,,,,,,,,,,,,,,,,,,,,,,,,,鹿留財産区  企業詳細  鹿留財産区  法人番号：1000030190017  基本情報 部署 人物 代表者名 - 住所 山梨県都留市上谷1丁目1-1 売上 - 従業員数 - 資本金 - 設立 - 上場区分 - 決算月 - 業種 電話番号 - URL - 来訪履歴  集計期間: 2025-10-21 〜 2025-11-20  最終来訪日時 - アクセス数 0 UU数 0 企業メモ 追加,,,,,,,,,,,1000030190017,,,,,,,,,,,,,,,,,,,,,,鹿留財産区  企業詳細  鹿留財産区  法人番号：1000030190017  基本情報 部署 人物 代表者名 - 住所 山梨県都留市上谷1丁目1-1 売上 - 従業員数 - 資本金 - 設立 - 上場区分 - 決算月 - 業種 電話番号 - URL - 来訪履歴  集計期間: 2025-10-21 〜 2025-11-20  最終来訪日時 - アクセス数 0 UU数 0 企業メモ 追加,LINEヤフー株式会社の企業情報のページです。,LINEヤフー株式会社の企業情報のページです。,,,,,,,,,
1000030190025,江曽原財産区,,,1000030190025,,,,,,2025-12-07T17:23:14.326Z,,,,,,山梨県山梨市小原西843,,1056021,,,-,,,Kingdomline@gdpr-rep.com,https://atrae.co.jp/external_transmission/,,-,,代表取締役,,,,,,,,,,,,,,,,,,,,,,,,,,,,,,,,,,,LINEヤフー株式会社の企業情報のページです。,,,,,江曽原財産区; 企業詳細; 江曽原財産区; 法人番号：1000030190025; 基本情報; 人物; 条件に一致する部署はありません。; 企業メモ; 追加,,,,,,,,,,,,非上場,,,-,,,,,,,,,,,,,,,,,,,,,,,,,,江曽原財産区  企業詳細  江曽原財産区  法人番号：1000030190025  基本情報 部署 人物 代表者名 - 住所 山梨県山梨市小原西843 売上 - 従業員数 - 資本金 - 設立 - 上場区分 - 決算月 - 業種 電話番号 - URL - 来訪履歴  集計期間: 2025-10-21 〜 2025-11-20  最終来訪日時 - アクセス数 0 UU数 0 企業メモ 追加,,,,,,,,,,,1000030190025,,,,,,,,,,,,,,,,,,,,,,江曽原財産区  企業詳細  江曽原財産区  法人番号：1000030190025  基本情報 部署 人物 代表者名 - 住所 山梨県山梨市小原西843 売上 - 従業員数 - 資本金 - 設立 - 上場区分 - 決算月 - 業種 電話番号 - URL - 来訪履歴  集計期間: 2025-10-21 〜 2025-11-20  最終来訪日時 - アクセス数 0 UU数 0 企業メモ 追加,LINEヤフー株式会社の企業情報のページです。,LINEヤフー株式会社の企業情報のページです。,,,,,,,,,
1000030190033,倉科財産区,,,1000030190033,,,,,,2025-12-07T17:23:14.326Z,,,,,,山梨県山梨市小原西843,,1056021,,,-,,,Kingdomline@gdpr-rep.com,https://atrae.co.jp/external_transmission/,,-,,代表取締役,,,,,,,,,,,,,,,,,,,,,,,,,,,,,,,,,,,LINEヤフー株式会社の企業情報のページです。,,,,,倉科財産区; 企業詳細; 倉科財産区; 法人番号：1000030190033; 基本情報; 人物; 条件に一致する部署はありません。; 企業メモ; 追加,,,,,,,,,,,,非上場,,,-,,,,,,,,,,,,,,,,,,,,,,,,,,倉科財産区  企業詳細  倉科財産区  法人番号：1000030190033  基本情報 部署 人物 代表者名 - 住所 山梨県山梨市小原西843 売上 - 従業員数 - 資本金 - 設立 - 上場区分 - 決算月 - 業種 電話番号 - URL - 来訪履歴  集計期間: 2025-10-21 〜 2025-11-20  最終来訪日時 - アクセス数 0 UU数 0 企業メモ 追加,,,,,,,,,,,1000030190033,,,,,,,,,,,,,,,,,,,,,,倉科財産区  企業詳細  倉科財産区  法人番号：1000030190033  基本情報 部署 人物 代表者名 - 住所 山梨県山梨市小原西843 売上 - 従業員数 - 資本金 - 設立 - 上場区分 - 決算月 - 業種 電話番号 - URL - 来訪履歴  集計期間: 2025-10-21 〜 2025-11-20  最終来訪日時 - アクセス数 0 UU数 0 企業メモ 追加,LINEヤフー株式会社の企業情報のページです。,LINEヤフー株式会社の企業情報のページです。,,,,,,,,,
1000030190041,中牧財産区,,,1000030190041,,,,,,2025-12-07T17:23:14.326Z,,,,,,山梨県山梨市小原西843,,1056021,,,-,,,Kingdomline@gdpr-rep.com,https://atrae.co.jp/external_transmission/,,-,,代表取締役,,,,,,,,,,,,,,,,,,,,,,,,,,,,,,,,,,,LINEヤフー株式会社の企業情報のページです。,,,,,中牧財産区; 企業詳細; 中牧財産区; 法人番号：1000030190041; 基本情報; 人物; 条件に一致する部署はありません。; 企業メモ; 追加,,,,,,,,,,,,非上場,,,-,,,,,,,,,,,,,,,,,,,,,,,,,,中牧財産区  企業詳細  中牧財産区  法人番号：1000030190041  基本情報 部署 人物 代表者名 - 住所 山梨県山梨市小原西843 売上 - 従業員数 - 資本金 - 設立 - 上場区分 - 決算月 - 業種 電話番号 - URL - 来訪履歴  集計期間: 2025-10-21 〜 2025-11-20  最終来訪日時 - アクセス数 0 UU数 0 企業メモ 追加,,,,,,,,,,,1000030190041,,,,,,,,,,,,,,,,,,,,,,中牧財産区  企業詳細  中牧財産区  法人番号：1000030190041  基本情報 部署 人物 代表者名 - 住所 山梨県山梨市小原西843 売上 - 従業員数 - 資本金 - 設立 - 上場区分 - 決算月 - 業種 電話番号 - URL - 来訪履歴  集計期間: 2025-10-21 〜 2025-11-20  最終来訪日時 - アクセス数 0 UU数 0 企業メモ 追加,LINEヤフー株式会社の企業情報のページです。,LINEヤフー株式会社の企業情報のページです。,,,,,,,,,
1000030190058,第二御座石前山恩賜林保護財産区,,,1000030190058,,,,,,2025-12-07T17:23:14.326Z,,,,,,山梨県韮崎市水神1丁目3-1,,1056021,,,-,,,Kingdomline@gdpr-rep.com,https://atrae.co.jp/external_transmission/,,-,,代表取締役,,,,,,,,,,,,,,,,,,,,,,,,,,,,,,,,,,,LINEヤフー株式会社の企業情報のページです。,,,,,第二御座石前山恩賜林保護財産区; 企業詳細; 第二御座石前山恩賜林保護財産区; 法人番号：1000030190058; 基本情報; 人物; 条件に一致する部署はありません。; 企業メモ; 追加,,,,,,,,,,,,非上場,,,-,,,,,,,,,,,,,,,,,,,,,,,,,,第二御座石前山恩賜林保護財産区  企業詳細  第二御座石前山恩賜林保護財産区  法人番号：1000030190058  基本情報 部署 人物 代表者名 - 住所 山梨県韮崎市水神1丁目3-1 売上 - 従業員数 - 資本金 - 設立 - 上場区分 - 決算月 - 業種 電話番号 - URL - 来訪履歴  集計期間: 2025-10-21 〜 2025-11-20  最終来訪日時 - アクセス数 0 UU数 0 企業メモ 追加,,,,,,,,,,,1000030190058,,,,,,,,,,,,,,,,,,,,,,第二御座石前山恩賜林保護財産区  企業詳細  第二御座石前山恩賜林保護財産区  法人番号：1000030190058  基本情報 部署 人物 代表者名 - 住所 山梨県韮崎市水神1丁目3-1 売上 - 従業員数 - 資本金 - 設立 - 上場区分 - 決算月 - 業種 電話番号 - URL - 来訪履歴  集計期間: 2025-10-21 〜 2025-11-20  最終来訪日時 - アクセス数 0 UU数 0 企業メモ 追加,LINEヤフー株式会社の企業情報のページです。,LINEヤフー株式会社の企業情報のページです。,,,,,,,,,
1000030190066,高尾山外一字恩賜県有財産保護財産区,,,1000030190066,,,,,,2025-12-07T17:23:14.326Z,,,,,,山梨県南アルプス市小笠原376,,1056021,,,-,,,Kingdomline@gdpr-rep.com,https://atrae.co.jp/external_transmission/,,-,,代表取締役,,,,,,,,,,,,,,,,,,,,,,,,,,,,,,,,,,,LINEヤフー株式会社の企業情報のページです。,,,,,高尾山外一字恩賜県有財産保護財産区; 企業詳細; 高尾山外一字恩賜県有財産保護財産区; 法人番号：1000030190066; 基本情報; 人物; 条件に一致する部署はありません。; 企業メモ; 追加,,,,,,,,,,,,非上場,,,-,,,,,,,,,,,,,,,,,,,,,,,,,,高尾山外一字恩賜県有財産保護財産区  企業詳細  高尾山外一字恩賜県有財産保護財産区  法人番号：1000030190066  基本情報 部署 人物 代表者名 - 住所 山梨県南アルプス市小笠原376 売上 - 従業員数 - 資本金 - 設立 - 上場区分 - 決算月 - 業種 電話番号 - URL - 来訪履歴  集計期間: 2025-10-21 〜 2025-11-20  最終来訪日時 - アクセス数 0 UU数 0 企業メモ 追加,,,,,,,,,,,1000030190066,,,,,,,,,,,,,,,,,,,,,,高尾山外一字恩賜県有財産保護財産区  企業詳細  高尾山外一字恩賜県有財産保護財産区  法人番号：1000030190066  基本情報 部署 人物 代表者名 - 住所 山梨県南アルプス市小笠原376 売上 - 従業員数 - 資本金 - 設立 - 上場区分 - 決算月 - 業種 電話番号 - URL - 来訪履歴  集計期間: 2025-10-21 〜 2025-11-20  最終来訪日時 - アクセス数 0 UU数 0 企業メモ 追加,LINEヤフー株式会社の企業情報のページです。,LINEヤフー株式会社の企業情報のページです。,,,,,,,,,
1000030190074,松尾山恩賜県有財産保護財産区,,,1000030190074,,,,,,2025-12-07T17:23:14.326Z,,,,,,山梨県北杜市須玉町若神子2155,,1056021,,,-,,,Kingdomline@gdpr-rep.com,https://atrae.co.jp/external_transmission/,,-,,代表取締役,,,,,,,,,,,,,,,,,,,,,,,,,,,,,,,,,,,LINEヤフー株式会社の企業情報のページです。,,,,,松尾山恩賜県有財産保護財産区; 企業詳細; 松尾山恩賜県有財産保護財産区; 法人番号：1000030190074; 基本情報; 人物; 条件に一致する部署はありません。; 企業メモ; 追加,,,,,,,,,,,,非上場,,,-,,,,,,,,,,,,,,,,,,,,,,,,,,松尾山恩賜県有財産保護財産区  企業詳細  松尾山恩賜県有財産保護財産区  法人番号：1000030190074  基本情報 部署 人物 代表者名 - 住所 山梨県北杜市須玉町若神子2155 売上 - 従業員数 - 資本金 - 設立 - 上場区分 - 決算月 - 業種 電話番号 - URL - 来訪履歴  集計期間: 2025-10-21 〜 2025-11-20  最終来訪日時 - アクセス数 0 UU数 0 企業メモ 追加,,,,,,,,,,,1000030190074,,,,,,,,,,,,,,,,,,,,,,松尾山恩賜県有財産保護財産区  企業詳細  松尾山恩賜県有財産保護財産区  法人番号：1000030190074  基本情報 部署 人物 代表者名 - 住所 山梨県北杜市須玉町若神子2155 売上 - 従業員数 - 資本金 - 設立 - 上場区分 - 決算月 - 業種 電話番号 - URL - 来訪履歴  集計期間: 2025-10-21 〜 2025-11-20  最終来訪日時 - アクセス数 0 UU数 0 企業メモ 追加,LINEヤフー株式会社の企業情報のページです。,LINEヤフー株式会社の企業情報のページです。,,,,,,,,,
1000030190082,増富財産区,,,1000030190082,,,,,,2025-12-07T17:23:14.326Z,,,,,,山梨県北杜市須玉町比志3621-30,,1056021,,,-,,,Kingdomline@gdpr-rep.com,https://atrae.co.jp/external_transmission/,,-,,代表取締役,,,,,,,,,,,,,,,,,,,,,,,,,,,,,,,,,,,LINEヤフー株式会社の企業情報のページです。,,,,,増富財産区; 企業詳細; 増富財産区; 法人番号：1000030190082; 基本情報; 人物; 条件に一致する部署はありません。; 企業メモ; 追加,,,,,,,,,,,,非上場,,,-,,,,,,,,,,,,,,,,,,,,,,,,,,増富財産区  企業詳細  増富財産区  法人番号：1000030190082  基本情報 部署 人物 代表者名 - 住所 山梨県北杜市須玉町比志3621-30 売上 - 従業員数 - 資本金 - 設立 - 上場区分 - 決算月 - 業種 電話番号 - URL - 来訪履歴  集計期間: 2025-10-21 〜 2025-11-20  最終来訪日時 - アクセス数 0 UU数 0 企業メモ 追加,,,,,,,,,,,1000030190082,,,,,,,,,,,,,,,,,,,,,,増富財産区  企業詳細  増富財産区  法人番号：1000030190082  基本情報 部署 人物 代表者名 - 住所 山梨県北杜市須玉町比志3621-30 売上 - 従業員数 - 資本金 - 設立 - 上場区分 - 決算月 - 業種 電話番号 - URL - 来訪履歴  集計期間: 2025-10-21 〜 2025-11-20  最終来訪日時 - アクセス数 0 UU数 0 企業メモ 追加,LINEヤフー株式会社の企業情報のページです。,LINEヤフー株式会社の企業情報のページです。,,,,,,,,,
1000030190090,石堂山恩賜県有財産保護財産区,,,1000030190090,,,,,,2025-12-07T17:23:14.326Z,,,,,,山梨県北杜市高根町村山北割3261,,1056021,,,-,,,Kingdomline@gdpr-rep.com,https://atrae.co.jp/external_transmission/,,-,,代表取締役,,,,,,,,,,,,,,,,,,,,,,,,,,,,,,,,,,,LINEヤフー株式会社の企業情報のページです。,,,,,石堂山恩賜県有財産保護財産区; 企業詳細; 石堂山恩賜県有財産保護財産区; 法人番号：1000030190090; 基本情報; 人物; 条件に一致する部署はありません。; 企業メモ; 追加,,,,,,,,,,,,非上場,,,-,,,,,,,,,,,,,,,,,,,,,,,,,,石堂山恩賜県有財産保護財産区  企業詳細  石堂山恩賜県有財産保護財産区  法人番号：1000030190090  基本情報 部署 人物 代表者名 - 住所 山梨県北杜市高根町村山北割3261 売上 - 従業員数 - 資本金 - 設立 - 上場区分 - 決算月 - 業種 電話番号 - URL - 来訪履歴  集計期間: 2025-10-21 〜 2025-11-20  最終来訪日時 - アクセス数 0 UU数 0 企業メモ 追加,,,,,,,,,,,1000030190090,,,,,,,,,,,,,,,,,,,,,,石堂山恩賜県有財産保護財産区  企業詳細  石堂山恩賜県有財産保護財産区  法人番号：1000030190090  基本情報 部署 人物 代表者名 - 住所 山梨県北杜市高根町村山北割3261 売上 - 従業員数 - 資本金 - 設立 - 上場区分 - 決算月 - 業種 電話番号 - URL - 来訪履歴  集計期間: 2025-10-21 〜 2025-11-20  最終来訪日時 - アクセス数 0 UU数 0 企業メモ 追加,LINEヤフー株式会社の企業情報のページです。,LINEヤフー株式会社の企業情報のページです。,,,,,,,,,
1000030190099,大日向山外十三字恩賜林保護財産区,,,1000030190099,,,,,,2025-12-07T17:23:14.326Z,,,,,,山梨県北杜市白州町白須312,,1056021,,,-,,,Kingdomline@gdpr-rep.com,https://atrae.co.jp/external_transmission/,,-,,代表取締役,,,,,,,,,,,,,,,,,,,,,,,,,,,,,,,,,,,LINEヤフー株式会社の企業情報のページです。,,,,,大日向山外十三字恩賜林保護財産区; 企業詳細; 大日向山外十三字恩賜林保護財産区; 法人番号：1000030190099; 基本情報; 人物; 条件に一致する部署はありません。; 企業メモ; 追加,,,,,,,,,,,,非上場,,,-,,,,,,,,,,,,,,,,,,,,,,,,,,大日向山外十三字恩賜林保護財産区  企業詳細  大日向山外十三字恩賜林保護財産区  法人番号：1000030190099  基本情報 部署 人物 代表者名 - 住所 山梨県北杜市白州町白須312 売上 - 従業員数 - 資本金 - 設立 - 上場区分 - 決算月 - 業種 電話番号 - URL - 来訪履歴  集計期間: 2025-10-21 〜 2025-11-20  最終来訪日時 - アクセス数 0 UU数 0 企業メモ 追加,,,,,,,,,,,1000030190099,,,,,,,,,,,,,,,,,,,,,,大日向山外十三字恩賜林保護財産区  企業詳細  大日向山外十三字恩賜林保護財産区  法人番号：1000030190099  基本情報 部署 人物 代表者名 - 住所 山梨県北杜市白州町白須312 売上 - 従業員数 - 資本金 - 設立 - 上場区分 - 決算月 - 業種 電話番号 - URL - 来訪履歴  集計期間: 2025-10-21 〜 2025-11-20  最終来訪日時 - アクセス数 0 UU数 0 企業メモ 追加,LINEヤフー株式会社の企業情報のページです。,LINEヤフー株式会社の企業情報のページです。,,,,,,,,,
1000030190108,棒道下恩賜林保護財産区,,,1000030190108,,,,,,2025-12-07T17:23:14.326Z,,,,,,山梨県北杜市小淵沢町7711,,1056021,,,-,,,Kingdomline@gdpr-rep.com,https://atrae.co.jp/external_transmission/,,-,,代表取締役,,,,,,,,,,,,,,,,,,,,,,,,,,,,,,,,,,,LINEヤフー株式会社の企業情報のページです。,,,,,棒道下恩賜林保護財産区; 企業詳細; 棒道下恩賜林保護財産区; 法人番号：1000030190108; 基本情報; 人物; 条件に一致する部署はありません。; 企業メモ; 追加,,,,,,,,,,,,非上場,,,-,,,,,,,,,,,,,,,,,,,,,,,,,,棒道下恩賜林保護財産区  企業詳細  棒道下恩賜林保護財産区  法人番号：1000030190108  基本情報 部署 人物 代表者名 - 住所 山梨県北杜市小淵沢町7711 売上 - 従業員数 - 資本金 - 設立 - 上場区分 - 決算月 - 業種 電話番号 - URL - 来訪履歴  集計期間: 2025-10-21 〜 2025-11-20  最終来訪日時 - アクセス数 0 UU数 0 企業メモ 追加,,,,,,,,,,,1000030190108,,,,,,,,,,,,,,,,,,,,,,棒道下恩賜林保護財産区  企業詳細  棒道下恩賜林保護財産区  法人番号：1000030190108  基本情報 部署 人物 代表者名 - 住所 山梨県北杜市小淵沢町7711 売上 - 従業員数 - 資本金 - 設立 - 上場区分 - 決算月 - 業種 電話番号 - URL - 来訪履歴  集計期間: 2025-10-21 〜 2025-11-20  最終来訪日時 - アクセス数 0 UU数 0 企業メモ 追加,LINEヤフー株式会社の企業情報のページです。,LINEヤフー株式会社の企業情報のページです。,,,,,,,,,
1000030190116,黒駒山恩賜県有財産保護財産区,,,1000030190116,,,,,,2025-12-07T17:23:14.326Z,,,,,,山梨県笛吹市石和町市部777,,1056021,,,-,,,,https://atrae.co.jp/external_transmission/,,-,,代表取締役,,,,,,,,,,,,,,,,,,,,,,,,,,,,,,,,,,,都道府県毎の企業を一覧にまとめました。,,,,,黒駒山恩賜県有財産保護財産区; 企業詳細; 黒駒山恩賜県有財産保護財産区; 法人番号：1000030190116; 基本情報; 人物; 条件に一致する部署はありません。; 企業メモ; 追加,,,,,,,,,,,,非上場,,,-,,,,,,,,,,,,,,,,,,,,,,,,,,黒駒山恩賜県有財産保護財産区  企業詳細  黒駒山恩賜県有財産保護財産区  法人番号：1000030190116  基本情報 部署 人物 代表者名 - 住所 山梨県笛吹市石和町市部777 売上 - 従業員数 - 資本金 - 設立 - 上場区分 - 決算月 - 業種 電話番号 - URL - 来訪履歴  集計期間: 2025-10-21 〜 2025-11-20  最終来訪日時 - アクセス数 0 UU数 0 企業メモ 追加,,,,,,,,,,,1000030190116,,,,,,,,,,,,,,,,,,,,,,黒駒山恩賜県有財産保護財産区  企業詳細  黒駒山恩賜県有財産保護財産区  法人番号：1000030190116  基本情報 部署 人物 代表者名 - 住所 山梨県笛吹市石和町市部777 売上 - 従業員数 - 資本金 - 設立 - 上場区分 - 決算月 - 業種 電話番号 - URL - 来訪履歴  集計期間: 2025-10-21 〜 2025-11-20  最終来訪日時 - アクセス数 0 UU数 0 企業メモ 追加,都道府県毎の企業を一覧にまとめました。,都道府県毎の企業を一覧にまとめました。,,,,,,,,,
1000030190124,大目財産区,,,1000030190124,,,,,,2025-12-07T17:23:14.326Z,,,,,,大目財産区  企業詳細  大目財産区  法人番号：1000030190124  基本情報 部署 人物 代表者名 - 住所 山梨県上野原市上野原3832 売上 - 従業員数 - 資本金 - 設立 - 上場区分 - 決算月 - 業種 電話番号 - URL - 来訪履歴  集計期間: 2025-10-21 〜 2025-11-20  最終来訪日時 - アクセス数 0 UU数 0 企業メモ 追加,,1056021,,,-,,,Kingdomline@gdpr-rep.com,https://atrae.co.jp/external_transmission/,,-,,代表取締役,,,,,,,,,,,,,,,,,,,,,,,,,,,,,,,,,,,LINEヤフー株式会社の企業情報のページです。,,,,,大目財産区; 企業詳細; 大目財産区; 法人番号：1000030190124; 基本情報; 人物; 条件に一致する部署はありません。; 企業メモ; 追加,,,,,,,,,,,,非上場,,,-,,,,,,,,,,,,,,,,,,,,,,,,,,大目財産区  企業詳細  大目財産区  法人番号：1000030190124  基本情報 部署 人物 代表者名 - 住所 山梨県上野原市上野原3832 売上 - 従業員数 - 資本金 - 設立 - 上場区分 - 決算月 - 業種 電話番号 - URL - 来訪履歴  集計期間: 2025-10-21 〜 2025-11-20  最終来訪日時 - アクセス数 0 UU数 0 企業メモ 追加,,,,,,,,,,,1000030190124,,,,,,,,,,,,,,,,,,,,,,大目財産区  企業詳細  大目財産区  法人番号：1000030190124  基本情報 部署 人物 代表者名 - 住所 山梨県上野原市上野原3832 売上 - 従業員数 - 資本金 - 設立 - 上場区分 - 決算月 - 業種 電話番号 - URL - 来訪履歴  集計期間: 2025-10-21 〜 2025-11-20  最終来訪日時 - アクセス数 0 UU数 0 企業メモ 追加,LINEヤフー株式会社の企業情報のページです。,LINEヤフー株式会社の企業情報のページです。,,,,,,,,,
1000030190132,萩原山財産区,,,1000030190132,,,,,,2025-12-07T17:23:14.326Z,,,,,,山梨県甲州市塩山,,1056021,,,-,,,Kingdomline@gdpr-rep.com,https://atrae.co.jp/external_transmission/,,-,,代表取締役,,,,,,,,,,,,,,,,,,,,,,,,,,,,,,,,,,,LINEヤフー株式会社の企業情報のページです。,,,,,萩原山財産区; 企業詳細; 萩原山財産区; 法人番号：1000030190132; 基本情報; 人物; 条件に一致する部署はありません。; 企業メモ; 追加,,,,,,,,,,,,非上場,,,-,,,,,,,,,,,,,,,,,,,,,,,,,,萩原山財産区  企業詳細  萩原山財産区  法人番号：1000030190132  基本情報 部署 人物 代表者名 - 住所 山梨県甲州市塩山上於曽1093 売上 - 従業員数 - 資本金 - 設立 - 上場区分 - 決算月 - 業種 電話番号 - URL - 来訪履歴  集計期間: 2025-10-21 〜 2025-11-20  最終来訪日時 - アクセス数 0 UU数 0 企業メモ 追加,,,,,,,,,,,1000030190132,,,,,,,,,,,,,,,,,,,,,,萩原山財産区  企業詳細  萩原山財産区  法人番号：1000030190132  基本情報 部署 人物 代表者名 - 住所 山梨県甲州市塩山上於曽1093 売上 - 従業員数 - 資本金 - 設立 - 上場区分 - 決算月 - 業種 電話番号 - URL - 来訪履歴  集計期間: 2025-10-21 〜 2025-11-20  最終来訪日時 - アクセス数 0 UU数 0 企業メモ 追加,LINEヤフー株式会社の企業情報のページです。,LINEヤフー株式会社の企業情報のページです。,,,,,,,,,
