1000020028185,黒石地区清掃施設組合,,,1000020028185,,,,,,2025-12-07T17:23:14.326Z,,,,,,青森県黒石市大字竹鼻字南野田62-1,,,,,-,,,,,,-,,,,,,,,,,,,,,,,,,,,,,,,,,,,,,,,,,,,,,,,,,黒石地区清掃施設組合; 企業詳細; 黒石地区清掃施設組合; 法人番号：1000020028185; 基本情報; 人物; 条件に一致する部署はありません。; 企業メモ; 追加,,,,,,,,,,,,非上場,,,-,,,,,,,,,,,,,,,,,,,,,,,,,,黒石地区清掃施設組合  企業詳細  黒石地区清掃施設組合  法人番号：1000020028185  基本情報 部署 人物 代表者名 - 住所 青森県黒石市大字竹鼻字南野田62-1 売上 - 従業員数 - 資本金 - 設立 - 上場区分 - 決算月 - 業種 電話番号 - URL - 来訪履歴  集計期間: 2025-10-21 〜 2025-11-20  最終来訪日時 - アクセス数 0 UU数 0 企業メモ 追加,,,,,,,,,,,1000020028185,,,,,,,,,,,,,,,,,,,,,,黒石地区清掃施設組合  企業詳細  黒石地区清掃施設組合  法人番号：1000020028185  基本情報 部署 人物 代表者名 - 住所 青森県黒石市大字竹鼻字南野田62-1 売上 - 従業員数 - 資本金 - 設立 - 上場区分 - 決算月 - 業種 電話番号 - URL - 来訪履歴  集計期間: 2025-10-21 〜 2025-11-20  最終来訪日時 - アクセス数 0 UU数 0 企業メモ 追加,,,,,,,,,,,
1000020028193,西北五環境整備事務組合,,,1000020028193,,,,,,2025-12-07T17:23:14.326Z,,,,,,青森県五所川原市字布屋町41番地1,,,,,-,,,,,,-,,,,,,,,,,,,,,,,,,,,,,,,,,,,,,,,,,,,,,,,,,西北五環境整備事務組合; 企業詳細; 西北五環境整備事務組合; 法人番号：1000020028193; 基本情報; 人物; 条件に一致する部署はありません。; 企業メモ; 追加,,,,,,,,,,,,非上場,,,-,,,,,,,,,,,,,,,,,,,,,,,,,,西北五環境整備事務組合  企業詳細  西北五環境整備事務組合  法人番号：1000020028193  基本情報 部署 人物 代表者名 - 住所 青森県五所川原市字布屋町41番地1 売上 - 従業員数 - 資本金 - 設立 - 上場区分 - 決算月 - 業種 電話番号 - URL - 来訪履歴  集計期間: 2025-10-21 〜 2025-11-20  最終来訪日時 - アクセス数 0 UU数 0 企業メモ 追加,,,,,,,,,,,1000020028193,,,,,,,,,,,,,,,,,,,,,,西北五環境整備事務組合  企業詳細  西北五環境整備事務組合  法人番号：1000020028193  基本情報 部署 人物 代表者名 - 住所 青森県五所川原市字布屋町41番地1 売上 - 従業員数 - 資本金 - 設立 - 上場区分 - 決算月 - 業種 電話番号 - URL - 来訪履歴  集計期間: 2025-10-21 〜 2025-11-20  最終来訪日時 - アクセス数 0 UU数 0 企業メモ 追加,,,,,,,,,,,
1000020028771,北部上北広域事務組合,,,1000020028771,,,,,,2025-12-07T17:23:14.326Z,,,,,,北部上北広域事務組合  企業詳細  北部上北広域事務組合  法人番号：1000020028771  基本情報 部署 人物 代表者名 - 住所 青森県上北郡野辺地町字田狭沢40-9 売上 - 従業員数 - 資本金 - 設立 - 上場区分 - 決算月 - 業種 電話番号 - URL - 来訪履歴  集計期間: 2025-10-21 〜 2025-11-20  最終来訪日時 - アクセス数 0 UU数 0 企業メモ 追加,,,,,-,,,,,,-,,,,,,,,,,,,,,,,,,,,,,,,,,,,,,,,,,,,,,,,,,北部上北広域事務組合; 企業詳細; 北部上北広域事務組合; 法人番号：1000020028771; 基本情報; 人物; 条件に一致する部署はありません。; 企業メモ; 追加,,,,,,,,,,,,非上場,,,-,,,,,,,,,,,,,,,,,,,,,,,,,,北部上北広域事務組合  企業詳細  北部上北広域事務組合  法人番号：1000020028771  基本情報 部署 人物 代表者名 - 住所 青森県上北郡野辺地町字田狭沢40-9 売上 - 従業員数 - 資本金 - 設立 - 上場区分 - 決算月 - 業種 電話番号 - URL - 来訪履歴  集計期間: 2025-10-21 〜 2025-11-20  最終来訪日時 - アクセス数 0 UU数 0 企業メモ 追加,,,,,,,,,,,1000020028771,,,,,,,,,,,,,,,,,,,,,,北部上北広域事務組合  企業詳細  北部上北広域事務組合  法人番号：1000020028771  基本情報 部署 人物 代表者名 - 住所 青森県上北郡野辺地町字田狭沢40-9 売上 - 従業員数 - 資本金 - 設立 - 上場区分 - 決算月 - 業種 電話番号 - URL - 来訪履歴  集計期間: 2025-10-21 〜 2025-11-20  最終来訪日時 - アクセス数 0 UU数 0 企業メモ 追加,,,,,,,,,,,
1000020033219,紫波町,,,1000020033219,,,,,,2025-12-04T02:09:05.641Z,,,,,,岩手県紫波郡紫波町紫波中央駅前2丁目3番地1,,,,,019-672-2111,,,,http://www.made-in-shiwa-agri.jp,,-,,,,,,,,,,,,,,,,,,,,,,,,,,,,,,大分類; 公務（他に分類されるものを除く）; 中分類; 地方公務; 小分類; 市町村機関; 細分類; 市町村機関,公務（他に分類されるものを除く）,地方公務,市町村機関,市町村機関,,,,,,,,紫波町; 企業詳細; 紫波町; 法人番号：1000020033219; 基本情報; 人物; 条件に一致する部署はありません。; 企業メモ; 追加,,,,,,,,,,,,非上場,,,-,,,,,,,,,,,,,,,,,,,,,,,,,,,,,,,,,,,,,1000020033219,,,,,,,,,,,,,,,,,,,,,,紫波町  企業詳細  紫波町  法人番号：1000020033219  基本情報 部署 人物 代表者名 - 住所 岩手県紫波郡紫波町紫波中央駅前2丁目3番地1 売上 - 従業員数 - 資本金 - 設立 - 上場区分 非上場 決算月 - 業種  大分類 公務（他に分類されるものを除く）  中分類 地方公務  小分類 市町村機関  細分類 市町村機関  電話番号 019-672-2111 URL http://www.made-in-shiwa-agri.jp 来訪履歴  集計期間: 2025-10-21 〜 2025-11-20  最終来訪日時 - アクセス数 0 UU数 0 企業メモ 追加,,,,,,,,,,,
1000020033227,矢巾町,,,1000020033227,,,,,,2025-12-04T02:09:05.580Z,,,,,,岩手県紫波郡矢巾町大字南矢幅第13地割123番地,,,,,019-697-2111,,,,http://www.town.yahaba.iwate.jp/,,-,,,,,,,,,,,,,,,,,,,,,,,,,,,,,,大分類; 公務（他に分類されるものを除く）; 中分類; 地方公務; 小分類; 市町村機関; 細分類; 市町村機関,公務（他に分類されるものを除く）,地方公務,市町村機関,市町村機関,,,,,,,,矢巾町; 企業詳細; 矢巾町; 法人番号：1000020033227; 基本情報; 人物; 条件に一致する部署はありません。; 企業メモ; 追加,,,,,,,,,,,,非上場,,,-,,,,,,,,,,,,,,,,,,,,,,,,,,,,,,,,,,,,,1000020033227,,,,,,,,,,,,,,,,,,,,,,矢巾町  企業詳細  矢巾町  法人番号：1000020033227  基本情報 部署 人物 代表者名 - 住所 岩手県紫波郡矢巾町大字南矢幅第13地割123番地 売上 - 従業員数 - 資本金 - 設立 - 上場区分 非上場 決算月 - 業種  大分類 公務（他に分類されるものを除く）  中分類 地方公務  小分類 市町村機関  細分類 市町村機関  電話番号 019-697-2111 URL http://www.town.yahaba.iwate.jp/ 来訪履歴  集計期間: 2025-10-21 〜 2025-11-20  最終来訪日時 - アクセス数 0 UU数 0 企業メモ 追加,,,,,,,,,,,
1000020035017,軽米町,,,1000020035017,,,,,,2025-12-07T17:23:14.326Z,,,,,,岩手県九戸郡軽米町大字軽米第10地割85番地,,,,,-,,,,,,-,,,,,,,,,,,,,,,,,,,,,,,,,,,,,,,,,,,,,,,,,,軽米町; 企業詳細; 軽米町; 法人番号：1000020035017; 基本情報; 人物; 条件に一致する部署はありません。; 企業メモ; 追加,,,,,,,,,,,,非上場,,,-,,,,,,,,,,,,,,,,,,,,,,,,,,軽米町  企業詳細  軽米町  法人番号：1000020035017  基本情報 部署 人物 代表者名 - 住所 岩手県九戸郡軽米町大字軽米第10地割85番地 売上 - 従業員数 - 資本金 - 設立 - 上場区分 - 決算月 - 業種 電話番号 - URL - 来訪履歴  集計期間: 2025-10-21 〜 2025-11-20  最終来訪日時 - アクセス数 0 UU数 0 企業メモ 追加,,,,,,,,,,,1000020035017,,,,,,,,,,,,,,,,,,,,,,軽米町  企業詳細  軽米町  法人番号：1000020035017  基本情報 部署 人物 代表者名 - 住所 岩手県九戸郡軽米町大字軽米第10地割85番地 売上 - 従業員数 - 資本金 - 設立 - 上場区分 - 決算月 - 業種 電話番号 - URL - 来訪履歴  集計期間: 2025-10-21 〜 2025-11-20  最終来訪日時 - アクセス数 0 UU数 0 企業メモ 追加,,,,,,,,,,,
1000020035033,野田村,,,1000020035033,,,,,,2025-12-04T02:09:05.481Z,,,,,,岩手県九戸郡野田村大字野田第20地割14番地,,,,,0194-78-2111,,,,http://www.vill.noda.iwate.jp/,,-,,,,,,,,,,,,,,,,,,,,,,,,,,,,,,大分類; 公務（他に分類されるものを除く）; 中分類; 地方公務; 小分類; 市町村機関; 細分類; 市町村機関,公務（他に分類されるものを除く）,地方公務,市町村機関,市町村機関,,,,,,,,野田村; 企業詳細; 野田村; 法人番号：1000020035033; 基本情報; 人物; 条件に一致する部署はありません。; 企業メモ; 追加,,,,,,,,,,,,非上場,,,-,,,,,,,,,,,,,,,,,,,,,,,,,,,,,,,,,,,,,1000020035033,,,,,,,,,,,,,,,,,,,,,,野田村  企業詳細  野田村  法人番号：1000020035033  基本情報 部署 人物 代表者名 - 住所 岩手県九戸郡野田村大字野田第20地割14番地 売上 - 従業員数 - 資本金 - 設立 - 上場区分 非上場 決算月 - 業種  大分類 公務（他に分類されるものを除く）  中分類 地方公務  小分類 市町村機関  細分類 市町村機関  電話番号 0194-78-2111 URL http://www.vill.noda.iwate.jp/ 来訪履歴  集計期間: 2025-10-21 〜 2025-11-20  最終来訪日時 - アクセス数 0 UU数 0 企業メモ 追加,,,,,,,,,,,
1000020038440,岩手県競馬組合,,,1000020038440,,,,,,,,,,,,岩手県盛岡市新庄字,,,,,019-651-2999,,,,http://www.iwatekeiba.or.jp/,,,,,,,,,,,,,,,,,,,,,,,,,,,,,,,,生活関連サービス業・娯楽業,生活関連サービス業・娯楽業,娯楽業,競輪・競馬等の競走場，競技団,競馬場; 競馬競技団,,,,,,,,,,10000000000,,,,,,,,,,非上場,,,-,,,,,,,,,,,,,,,,11,,,,,,,,,,1964年3月1日,,,,,,,,,,,,,,,,,,,,,,,,,,,,,,,,,,,,,,,,,,,,
1000020042021,石巻市,,,1000020042021,,,,,,2025-12-04T02:09:05.426Z,,,,,,宮城県石巻市穀町14-1,,,,,0225-95-1111,,,,http://www.city.ishinomaki.lg.jp/,,-,,,,,,,,,,,,,,,,,,,,,,,,,,,,,,大分類; 公務（他に分類されるものを除く）; 中分類; 地方公務; 小分類; 市町村機関; 細分類; 市町村機関,公務（他に分類されるものを除く）,地方公務,市町村機関,市町村機関,,,,,,,,石巻市; 企業詳細; 石巻市; 法人番号：1000020042021; 基本情報; 人物; 条件に一致する部署はありません。; 企業メモ; 追加,,,,,,,,,,,,非上場,,,-,,,,,,,,,,,,,,,,,,,,,,,,,,,,,,,,,,,,,1000020042021,,,,,,,,,,,,,,,,,,,,,,石巻市  企業詳細  石巻市  法人番号：1000020042021  基本情報 部署 人物 代表者名 - 住所 宮城県石巻市穀町14-1 売上 - 従業員数 - 資本金 - 設立 - 上場区分 非上場 決算月 - 業種  大分類 公務（他に分類されるものを除く）  中分類 地方公務  小分類 市町村機関  細分類 市町村機関  電話番号 0225-95-1111 URL http://www.city.ishinomaki.lg.jp/ 来訪履歴  集計期間: 2025-10-21 〜 2025-11-20  最終来訪日時 - アクセス数 0 UU数 0 企業メモ 追加,,,,,,,,,,,
1000020042129,登米市,,,1000020042129,,,,,,2025-12-04T02:09:05.369Z,,,,,,宮城県登米市迫町佐沼字中江2丁目6-1,,,,,0220-22-2111,,,,http://www.city.tome.miyagi.jp/,,-,,,,,,,,,,,,,,,,,,,,,,,,,,,,,,大分類; 公務（他に分類されるものを除く）; 中分類; 地方公務; 小分類; 市町村機関; 細分類; 市町村機関,公務（他に分類されるものを除く）,地方公務,市町村機関,市町村機関,,,,,,,,登米市; 企業詳細; 登米市; 法人番号：1000020042129; 基本情報; 人物; 条件に一致する部署はありません。; 企業メモ; 追加,,,,,,,,,,,,非上場,,,-,,,,,,,,,,,,,,,,,,,,,,,,,,,,,,,,,,,,,1000020042129,,,,,,,,,,,,,,,,,,,,,,登米市  企業詳細  登米市  法人番号：1000020042129  基本情報 部署 人物 代表者名 - 住所 宮城県登米市迫町佐沼字中江2丁目6-1 売上 - 従業員数 - 資本金 - 設立 - 上場区分 非上場 決算月 - 業種  大分類 公務（他に分類されるものを除く）  中分類 地方公務  小分類 市町村機関  細分類 市町村機関  電話番号 0220-22-2111 URL http://www.city.tome.miyagi.jp/ 来訪履歴  集計期間: 2025-10-21 〜 2025-11-20  最終来訪日時 - アクセス数 0 UU数 0 企業メモ 追加,,,,,,,,,,,
1000020042137,栗原市,,,1000020042137,,,,,,2025-12-04T02:09:05.318Z,,,,,,宮城県栗原市築館薬師一丁目7番1号,,,,,0228-22-1122,,,,http://www.kuriharacity.jp/,,-,,,,,,,,,,,,,,,,,,,,,,,,,,,,,,大分類; 公務（他に分類されるものを除く）; 中分類; 地方公務; 小分類; 市町村機関; 細分類; 市町村機関,公務（他に分類されるものを除く）,地方公務,市町村機関,市町村機関,,,,,,,,栗原市; 企業詳細; 栗原市; 法人番号：1000020042137; 基本情報; 人物; 条件に一致する部署はありません。; 企業メモ; 追加,10000000,,,,,,,,,,,非上場,,,-,,,,,,,,,,,,,,,,101,,,,,,,,,,,,,,,,,,,,,1000020042137,,,,,,,,,,,,,,,,,,,,,,栗原市  企業詳細  栗原市  法人番号：1000020042137  基本情報 部署 人物 代表者名 - 住所 宮城県栗原市築館薬師一丁目7番1号 売上 - 従業員数 101 ~ 300人 資本金 1000万 ~ 3000万円 設立 - 上場区分 非上場 決算月 - 業種  大分類 公務（他に分類されるものを除く）  中分類 地方公務  小分類 市町村機関  細分類 市町村機関  電話番号 0228-22-1122 URL http://www.kuriharacity.jp/ 来訪履歴  集計期間: 2025-10-21 〜 2025-11-20  最終来訪日時 - アクセス数 0 UU数 0 企業メモ 追加,,,,,,,,,,,
1000020042145,東松島市,,,1000020042145,,,,,,2025-12-04T02:09:05.269Z,,,,,,宮城県東松島市矢本字,,,,,0225-82-1111,,,,http://www.city.higashimatsushima.miyagi.jp/,,-,,,,,,,,,,,,,,,,,,,,,,,,,,,,,,大分類; 公務（他に分類されるものを除く）; 中分類; 地方公務; 小分類; 市町村機関; 細分類; 市町村機関,公務（他に分類されるものを除く）,地方公務,市町村機関,市町村機関,,,,,,,,東松島市; 企業詳細; 東松島市; 法人番号：1000020042145; 基本情報; 人物; 条件に一致する部署はありません。; 企業メモ; 追加,,,,,,,,,,,,非上場,,,-,,,,,,,,,,,,,,,,,,,,,,,,,,,,,,,,,,,,,1000020042145,,,,,,,,,,,,,,,,,,,,,,東松島市  企業詳細  東松島市  法人番号：1000020042145  基本情報 部署 人物 代表者名 - 住所 宮城県東松島市矢本字上河戸36-1 売上 - 従業員数 - 資本金 - 設立 - 上場区分 非上場 決算月 - 業種  大分類 公務（他に分類されるものを除く）  中分類 地方公務  小分類 市町村機関  細分類 市町村機関  電話番号 0225-82-1111 URL http://www.city.higashimatsushima.miyagi.jp/ 来訪履歴  集計期間: 2025-10-21 〜 2025-11-20  最終来訪日時 - アクセス数 0 UU数 0 企業メモ 追加,,,,,,,,,,,
1000020042153,大崎市,,,1000020042153,,,,,,2025-12-04T02:09:05.215Z,,,,,,宮城県大崎市古川七日町1-1,,,,,0229-23-2111,,,,http://www.city.osaki.miyagi.jp/,,-,,,,,,,,,,,,,,,,,,,,,,,,,,,,,,大分類; 公務（他に分類されるものを除く）; 中分類; 地方公務; 小分類; 市町村機関; 細分類; 市町村機関,公務（他に分類されるものを除く）,地方公務,市町村機関,市町村機関,,,,,,,,大崎市; 企業詳細; 大崎市; 法人番号：1000020042153; 基本情報; 人物; 条件に一致する部署はありません。; 企業メモ; 追加,,,,,,,,,,,,非上場,,,-,,,,,,,,,,,,,,,,,,,,,,,,,,,,,,,,,,,,,1000020042153,,,,,,,,,,,,,,,,,,,,,,大崎市  企業詳細  大崎市  法人番号：1000020042153  基本情報 部署 人物 代表者名 - 住所 宮城県大崎市古川七日町1-1 売上 - 従業員数 - 資本金 - 設立 - 上場区分 非上場 決算月 - 業種  大分類 公務（他に分類されるものを除く）  中分類 地方公務  小分類 市町村機関  細分類 市町村機関  電話番号 0229-23-2111 URL http://www.city.osaki.miyagi.jp/ 来訪履歴  集計期間: 2025-10-21 〜 2025-11-20  最終来訪日時 - アクセス数 0 UU数 0 企業メモ 追加,,,,,,,,,,,
1000020042161,富谷市,,,1000020042161,,,,,,2025-12-04T02:09:05.163Z,,,,,,宮城県富谷市富谷坂松田30番地,,,,,022-358-3111,,,,http://www.tomiya-city.miyagi.jp/,,-,,,,,,,,,,,,,,,,,,,,,,,,,,,,,,大分類; 公務（他に分類されるものを除く）; 中分類; 地方公務; 小分類; 市町村機関; 細分類; 市町村機関,公務（他に分類されるものを除く）,地方公務,市町村機関,市町村機関,,,,,,,,富谷市; 企業詳細; 富谷市; 法人番号：1000020042161; 基本情報; 人物; 条件に一致する部署はありません。; 企業メモ; 追加,,,,,,,,,,,,非上場,,,-,,,,,,,,,,,,,,,,,,,,,,,,,,,,,,,,,,,,,1000020042161,,,,,,,,,,,,,,,,,,,,,,富谷市  企業詳細  富谷市  法人番号：1000020042161  基本情報 部署 人物 代表者名 - 住所 宮城県富谷市富谷坂松田30番地 売上 - 従業員数 - 資本金 - 設立 - 上場区分 非上場 決算月 - 業種  大分類 公務（他に分類されるものを除く）  中分類 地方公務  小分類 市町村機関  細分類 市町村機関  電話番号 022-358-3111 URL http://www.tomiya-city.miyagi.jp/ 来訪履歴  集計期間: 2025-10-21 〜 2025-11-20  最終来訪日時 - アクセス数 0 UU数 0 企業メモ 追加,,,,,,,,,,,
1000020043028,七ケ宿町,,,1000020043028,,,,,,2025-12-07T17:23:14.326Z,,,,,,宮城県刈田郡七ヶ宿町字関126,,,,,-,,,,,,-,,,,,,,,,,,,,,,,,,,,,,,,,,,,,,,,,,,,,,,,,,七ケ宿町; 企業詳細; 七ケ宿町; 法人番号：1000020043028; 基本情報; 人物; 条件に一致する部署はありません。; 企業メモ; 追加,,,,,,,,,,,,非上場,,,-,,,,,,,,,,,,,,,,,,,,,,,,,,七ケ宿町  企業詳細  七ケ宿町  法人番号：1000020043028  基本情報 部署 人物 代表者名 - 住所 宮城県刈田郡七ヶ宿町字関126 売上 - 従業員数 - 資本金 - 設立 - 上場区分 - 決算月 - 業種 電話番号 - URL - 来訪履歴  集計期間: 2025-10-21 〜 2025-11-20  最終来訪日時 - アクセス数 0 UU数 0 企業メモ 追加,,,,,,,,,,,1000020043028,,,,,,,,,,,,,,,,,,,,,,七ケ宿町  企業詳細  七ケ宿町  法人番号：1000020043028  基本情報 部署 人物 代表者名 - 住所 宮城県刈田郡七ヶ宿町字関126 売上 - 従業員数 - 資本金 - 設立 - 上場区分 - 決算月 - 業種 電話番号 - URL - 来訪履歴  集計期間: 2025-10-21 〜 2025-11-20  最終来訪日時 - アクセス数 0 UU数 0 企業メモ 追加,,,,,,,,,,,
1000020044067,利府町,,,1000020044067,,,,,,2025-12-04T02:09:05.036Z,,,,,,宮城県宮城郡利府町利府字新並松4,,,,,022-767-2111,,,,https://www.town.rifu.miyagi.jp/,,-,,,,,,,,,,,,,,,,,,,,,,,,,,,,,,大分類; 公務（他に分類されるものを除く）; 中分類; 地方公務; 小分類; 市町村機関; 細分類; 市町村機関,公務（他に分類されるものを除く）,地方公務,市町村機関,市町村機関,,,,,,,,利府町; 企業詳細; 利府町; 法人番号：1000020044067; 基本情報; 人物; 条件に一致する部署はありません。; 企業メモ; 追加,,,,,,,,,,,,非上場,,,-,,,,,,,,,,,,,,,,,,,,,,,,,,,,,,,,,,,,,1000020044067,,,,,,,,,,,,,,,,,,,,,,利府町  企業詳細  利府町  法人番号：1000020044067  基本情報 部署 人物 代表者名 - 住所 宮城県宮城郡利府町利府字新並松4 売上 - 従業員数 - 資本金 - 設立 - 上場区分 非上場 決算月 - 業種  大分類 公務（他に分類されるものを除く）  中分類 地方公務  小分類 市町村機関  細分類 市町村機関  電話番号 022-767-2111 URL https://www.town.rifu.miyagi.jp/ 来訪履歴  集計期間: 2025-10-21 〜 2025-11-20  最終来訪日時 - アクセス数 0 UU数 0 企業メモ 追加,,,,,,,,,,,
1000020048101,色麻町外一市一ヶ村花川ダム管理組合,,,1000020048101,,,,,,2025-12-07T17:23:14.326Z,,,,,,宮城県加美郡色麻町四竃字北谷地41番地,,,,,-,,,,,,-,,,,,,,,,,,,,,,,,,,,,,,,,,,,,,,,,,,,,,,,,,色麻町外一市一ヶ村花川ダム管理組合; 企業詳細; 色麻町外一市一ヶ村花川ダム管理組合; 法人番号：1000020048101; 基本情報; 人物; 条件に一致する部署はありません。; 企業メモ; 追加,,,,,,,,,,,,非上場,,,-,,,,,,,,,,,,,,,,,,,,,,,,,,色麻町外一市一ヶ村花川ダム管理組合  企業詳細  色麻町外一市一ヶ村花川ダム管理組合  法人番号：1000020048101  基本情報 部署 人物 代表者名 - 住所 宮城県加美郡色麻町四竃字北谷地41番地 売上 - 従業員数 - 資本金 - 設立 - 上場区分 - 決算月 - 業種 電話番号 - URL - 来訪履歴  集計期間: 2025-10-21 〜 2025-11-20  最終来訪日時 - アクセス数 0 UU数 0 企業メモ 追加,,,,,,,,,,,1000020048101,,,,,,,,,,,,,,,,,,,,,,色麻町外一市一ヶ村花川ダム管理組合  企業詳細  色麻町外一市一ヶ村花川ダム管理組合  法人番号：1000020048101  基本情報 部署 人物 代表者名 - 住所 宮城県加美郡色麻町四竃字北谷地41番地 売上 - 従業員数 - 資本金 - 設立 - 上場区分 - 決算月 - 業種 電話番号 - URL - 来訪履歴  集計期間: 2025-10-21 〜 2025-11-20  最終来訪日時 - アクセス数 0 UU数 0 企業メモ 追加,,,,,,,,,,,
1000020049727,宮城県後期高齢者医療広域連合,,,1000020049727,,,,,,,,,,,,宮城県仙台市青葉区,,,,,022-266-1026,,,,http://www.miyagi-kouiki.jp/,,,,,,,,,,,,,,,,,,,,,,,,,,,,,,,,公務（他に分類されるものを除く）,公務（他に分類されるものを除く）,地方公務,都道府県機関; 市町村機関,都道府県機関; 市町村機関,,,,,,,,,,100000000000,,,,,,,,,,非上場,,,-,,,,,,,,,,,,,,,,31,,,,,,,,,,2007年2月1日,,,,,,,,,,,,,,,,,,,,,,,,,,,,,,,,,,,,,,,,,,,,
1000020050008,秋田県,,,1000020050008,,,,,,2025-12-04T02:09:04.930Z,,,,,,秋田県秋田市山王4丁目1-1,,,,,018-860-1111,,,,https://www.pref.akita.lg.jp/,,-,,,,,,,,,,,,,,,,,,,,,,,,,,,,,,大分類; 公務（他に分類されるものを除く）; 中分類; 地方公務; 小分類; 都道府県機関; 細分類; 都道府県機関,公務（他に分類されるものを除く）,地方公務,都道府県機関,都道府県機関,,,,,,,,秋田県; 企業詳細; 秋田県; 法人番号：1000020050008; 基本情報; 人物; 条件に一致する部署はありません。; 企業メモ; 追加,,,,,,,,,,,,非上場,,,-,,,,,,,,,,,,,,,,,,,,,,,,,,,,,,,,,,,,,1000020050008,,,,,,,,,,,,,,,,,,,,,,秋田県  企業詳細  秋田県  法人番号：1000020050008  基本情報 部署 人物 代表者名 - 住所 秋田県秋田市山王4丁目1-1 売上 - 従業員数 - 資本金 - 設立 - 上場区分 非上場 決算月 - 業種  大分類 公務（他に分類されるものを除く）  中分類 地方公務  小分類 都道府県機関  細分類 都道府県機関  電話番号 018-860-1111 URL https://www.pref.akita.lg.jp/ 来訪履歴  集計期間: 2025-10-21 〜 2025-11-20  最終来訪日時 - アクセス数 0 UU数 0 企業メモ 追加,,,,,,,,,,,
1000020052078,湯沢市,,,1000020052078,,,,,,2025-12-07T17:23:14.326Z,,,,,,秋田県湯沢市佐竹町1-1,,,,,0183-73-2111,,,,https://www.city-yuzawa.jp/,,-,,,,,,,,,,,,,,,,,,,,,,,,,,,,,,,,,,,,,,,,,,湯沢市; 企業詳細; 湯沢市; 法人番号：1000020052078; 基本情報; 人物; 条件に一致する部署はありません。; 企業メモ; 追加,,,,,,,,,,,,非上場,,,-,,,,,,,,,,,,,,,,,,,,,,,,,,,,,,,,,,,,,1000020052078,,,,,,,,,,,,,,,,,,,,,,湯沢市  企業詳細  湯沢市  法人番号：1000020052078  基本情報 部署 人物 代表者名 - 住所 秋田県湯沢市佐竹町1-1 売上 - 従業員数 - 資本金 - 設立 - 上場区分 - 決算月 - 業種 電話番号 0183-73-2111 URL https://www.city-yuzawa.jp/ 来訪履歴  集計期間: 2025-10-21 〜 2025-11-20  最終来訪日時 - アクセス数 0 UU数 0 企業メモ 追加,,,,,,,,,,,
1000020052094,鹿角市,,,1000020052094,,,,,,2025-12-04T02:09:04.826Z,,,,,,秋田県鹿角市花輪字荒田4-1,,,,,0186-30-0203,,,,http://www.city.kazuno.akita.jp/,,-,,,,,,,,,,,,,,,,,,,,,,,,,,,,,,大分類; 公務（他に分類されるものを除く）; 中分類; 地方公務; 小分類; 市町村機関; 細分類; 市町村機関,公務（他に分類されるものを除く）,地方公務,市町村機関,市町村機関,,,,,,,,鹿角市; 企業詳細; 鹿角市; 法人番号：1000020052094; 基本情報; 人物; 条件に一致する部署はありません。; 企業メモ; 追加,,,,,,,,,,,,非上場,,,-,,,,,,,,,,,,,,,,,,,,,,,,,,,,,,,,,,,,,1000020052094,,,,,,,,,,,,,,,,,,,,,,鹿角市  企業詳細  鹿角市  法人番号：1000020052094  基本情報 部署 人物 代表者名 - 住所 秋田県鹿角市花輪字荒田4-1 売上 - 従業員数 - 資本金 - 設立 - 上場区分 非上場 決算月 - 業種  大分類 公務（他に分類されるものを除く）  中分類 地方公務  小分類 市町村機関  細分類 市町村機関  電話番号 0186-30-0203 URL http://www.city.kazuno.akita.jp/ 来訪履歴  集計期間: 2025-10-21 〜 2025-11-20  最終来訪日時 - アクセス数 0 UU数 0 企業メモ 追加,,,,,,,,,,,
